{
  "event": "call.offer",
  "timestamp": "2026-10-15T12:00:00Z",
  "device_id": "5511900000000@s.whatsapp.net",
  "payload": {
    "call_id": "A1B2C3D4E5F60718293A4B5C6D7E8F90",
    "from": "5511900000001@s.whatsapp.net",
    "from_lid": "123456789012345@lid",
    "auto_rejected": false,
    "remote_platform": "android",
    "calls_enabled": true,
    "direction": "USER_INITIATED",
    "peer": { "pn": "5511900000001@s.whatsapp.net", "lid": "123456789012345@lid" },
    "offer_sdp": "v=0\r\no=- 1 2 IN IP4 203.0.113.7\r\ns=-\r\nt=0 0\r\na=ice-lite\r\n"
  }
}
